{
  "schema_version": "single-actuator-trace.v1",
  "lab_id": "sam3-concept-segment",
  "run_id": "sam3-face-control",
  "mode": "organ_direct",
  "actuator_lock": "concept_segment",
  "captured_at": "2026-08-08T16:01:12+00:00",
  "manifest": {
    "schema_version": "single-actuator-manifest.v1",
    "lab_id": "sam3-concept-segment",
    "run_id": "sam3-face-control",
    "title": "A concept anyone can check by eye",
    "why": "The floor of the matrix. `face` on a fixture containing two of them (Mary's, tilted down; Christ's, fallen back) is the one run where a reviewer needs no expertise and no gold mask to say whether the organ was right. Every harder phrase in this lab is read against it: if `face` fails here, nothing else in the matrix says anything about phrases at all, because the organ itself is not working on this picture.\nIt also probes the plural claim. Two faces are visibly present, so `instance_count` is checkable rather than merely plausible.\n",
    "actuator_lock": "concept_segment",
    "mode": "organ_direct",
    "call_budget": 1,
    "image": {
      "source": "local_fixture",
      "path": "research/rehearsals/fixtures/002F-pieta-single-object/pieta-in-situ.jpg",
      "sha256": "8882d66ff3f9f4c16e13406039ed1412d21fcbad43fc6bb917120ad1f8c0cfe4"
    },
    "prompt": null,
    "control_phrase": "face",
    "allowed_params": [
      "phrase"
    ],
    "model_expectation": {
      "checkpoint": "facebook/sam3",
      "preprocessing_version": "sam3-pcs-v1",
      "conf": 0.25,
      "imgsz": 1024,
      "max_instances": 16
    },
    "warm_or_cold": "warm",
    "repeat_count": 1,
    "expected_condition": "positive",
    "review": {
      "protocol": "human_visual",
      "gold_mask_path": null,
      "questions": [
        "Two faces are visible. How many did it return, and are they the faces?",
        "Did it mask any of the painted figures in the apse behind the sculpture?"
      ]
    },
    "pair_with": null
  },
  "environment": {
    "git_commit": "e3fa9e7ec7054d76c96a46e56b96c09e6544f947",
    "git_dirty": true,
    "platform": "Darwin 25.5.0 arm64",
    "python": "3.12.13",
    "device": "mps",
    "weights_present": true,
    "weights_id": "sam3.pt",
    "runtime_available": true,
    "checkpoint": "facebook/sam3",
    "preprocessing_version": "sam3-pcs-v1",
    "conf": 0.25,
    "imgsz": 1024,
    "naming_floor": 0.5,
    "torch_version": "2.13.0",
    "imgsz_effective": null,
    "imgsz_note": "requested only. Ultralytics rounds imgsz up to a multiple of the model stride inside the inference call and does not write the rounded value back to predictor.args, so the effective size cannot be read from this seam. Observed in the SAM 3 runs: a requested 1024 was logged as 1036. Recorded as absent rather than filled in with the request."
  },
  "prompt_receipt": {
    "original_prompt": null,
    "prompt_sha256": null,
    "control_phrase": "face",
    "planner_role": null,
    "planner_model": null,
    "planner_status": "not_applicable",
    "planner_detail": null,
    "raw_proposal": null
  },
  "decision_receipt": {
    "catalogue_shown": [
      {
        "actuator": "concept_segment",
        "does": "Measure every instance of a named concept, as real pixel masks.",
        "requires": [
          "image",
          "phrase"
        ],
        "produces": [
          "region",
          "mark"
        ],
        "params_you_may_set": [
          "phrase"
        ]
      }
    ],
    "selected_actuator": "concept_segment",
    "selected_phrase": "face",
    "phrase_source": "control",
    "refused_actions": [],
    "dropped_params": [],
    "planner_notes": []
  },
  "invocations": [
    {
      "call_index": 1,
      "call_budget": 1,
      "actuator": "concept_segment",
      "adapter": "sam3",
      "kind": "organ",
      "started_at": 1786204857.99374,
      "ended_at": 1786204871.988296,
      "latency_ms": 13994.5,
      "warm": false,
      "load_ms": 2.1,
      "outcome": "ok",
      "error": null
    }
  ],
  "organ_observation": {
    "status": "ok",
    "concept": "face",
    "instance_count": 3,
    "truncated": false,
    "latency_ms": 13988.4,
    "device": "mps",
    "model": "facebook/sam3",
    "error": null,
    "detail": null,
    "instances": [
      {
        "index": 0,
        "confidence": 0.8086,
        "mask_rle_sha256": "7fb4970098b4d816e230c7774c7516bcbc7c3e4a99abd0b212c3beeb160895b3",
        "area_px": 338,
        "area_fraction": 0.000914,
        "bounds": {
          "x": 0.488971,
          "y": 0.548529,
          "w": 0.036765,
          "h": 0.035294
        },
        "mask_size": [
          680,
          544
        ],
        "well_formed": true
      },
      {
        "index": 1,
        "confidence": 0.4701,
        "mask_rle_sha256": "6dec7b1676b82a4f6c05e325a3e433581827147c47b7ba610a9806dff42d8a82",
        "area_px": 172,
        "area_fraction": 0.000465,
        "bounds": {
          "x": 0.400735,
          "y": 0.6,
          "w": 0.03125,
          "h": 0.019118
        },
        "mask_size": [
          680,
          544
        ],
        "well_formed": true
      },
      {
        "index": 2,
        "confidence": 0.3538,
        "mask_rle_sha256": "93dce934b2b952847d7d9635af7e24f3aabc1c6efd54c67f05d367372cc41ffd",
        "area_px": 302,
        "area_fraction": 0.000816,
        "bounds": {
          "x": 0.380515,
          "y": 0.595588,
          "w": 0.051471,
          "h": 0.023529
        },
        "mask_size": [
          680,
          544
        ],
        "well_formed": true
      }
    ],
    "repeats": [],
    "max_pairwise_iou": 0.538961
  },
  "actuator_observation": null,
  "invariance": {
    "image_sha256_before": "8882d66ff3f9f4c16e13406039ed1412d21fcbad43fc6bb917120ad1f8c0cfe4",
    "image_sha256_after": "8882d66ff3f9f4c16e13406039ed1412d21fcbad43fc6bb917120ad1f8c0cfe4",
    "image_unchanged": true,
    "actuators_called": [
      "concept_segment"
    ],
    "lock_held": true,
    "database_writes_attempted": [],
    "post_mutated": false,
    "post_sha256_before": null,
    "post_sha256_after": null
  },
  "artifacts": {
    "overlay": "overlay.png",
    "contact_sheet": "contact-sheet.png",
    "review": "review.md",
    "observations": [
      "observations/instance-000.json",
      "observations/instance-001.json",
      "observations/instance-002.json",
      "observations/masks.json"
    ]
  }
}
