{
  "schema_version": "single-actuator-trace.v1",
  "lab_id": "sam3-concept-segment",
  "run_id": "sam3-fold-synonym-architecture",
  "mode": "organ_direct",
  "actuator_lock": "concept_segment",
  "captured_at": "2026-08-08T16:01:59+00:00",
  "manifest": {
    "schema_version": "single-actuator-manifest.v1",
    "lab_id": "sam3-concept-segment",
    "run_id": "sam3-fold-synonym-architecture",
    "title": "Fold synonym \u2014 folding architecture",
    "why": "The third fold phrase, and the one that should behave differently. `folding architecture` uses the same root word but names a different KIND of thing, and this image contains real architecture \u2014 the apse, the cross, the plinth \u2014 behind the cloth. If the organ binds on the word `folding` and masks the drapery anyway, that is a measurable case of the phrase's head noun being ignored; if it masks the apse, that is the phrase working and the concept being absent. Both are findings, and they are not the same finding.\n",
    "actuator_lock": "concept_segment",
    "mode": "organ_direct",
    "call_budget": 1,
    "image": {
      "source": "local_fixture",
      "path": "research/rehearsals/fixtures/002F-pieta-single-object/pieta-in-situ.jpg",
      "sha256": "8882d66ff3f9f4c16e13406039ed1412d21fcbad43fc6bb917120ad1f8c0cfe4"
    },
    "prompt": null,
    "control_phrase": "folding architecture",
    "allowed_params": [
      "phrase"
    ],
    "model_expectation": {
      "checkpoint": "facebook/sam3",
      "preprocessing_version": "sam3-pcs-v1",
      "conf": 0.25,
      "imgsz": 1024,
      "max_instances": 16
    },
    "warm_or_cold": "warm",
    "repeat_count": 1,
    "expected_condition": "open",
    "review": {
      "protocol": "human_visual",
      "gold_mask_path": null,
      "questions": [
        "Did it mask cloth (binding on `folding`) or built structure (binding on `architecture`)?",
        "If it returned nothing, is that the honest answer for this picture?"
      ]
    },
    "pair_with": "sam3-fold-control-organ"
  },
  "environment": {
    "git_commit": "e3fa9e7ec7054d76c96a46e56b96c09e6544f947",
    "git_dirty": true,
    "platform": "Darwin 25.5.0 arm64",
    "python": "3.12.13",
    "device": "mps",
    "weights_present": true,
    "weights_id": "sam3.pt",
    "runtime_available": true,
    "checkpoint": "facebook/sam3",
    "preprocessing_version": "sam3-pcs-v1",
    "conf": 0.25,
    "imgsz": 1024,
    "naming_floor": 0.5,
    "torch_version": "2.13.0",
    "imgsz_effective": null,
    "imgsz_note": "requested only. Ultralytics rounds imgsz up to a multiple of the model stride inside the inference call and does not write the rounded value back to predictor.args, so the effective size cannot be read from this seam. Observed in the SAM 3 runs: a requested 1024 was logged as 1036. Recorded as absent rather than filled in with the request."
  },
  "prompt_receipt": {
    "original_prompt": null,
    "prompt_sha256": null,
    "control_phrase": "folding architecture",
    "planner_role": null,
    "planner_model": null,
    "planner_status": "not_applicable",
    "planner_detail": null,
    "raw_proposal": null
  },
  "decision_receipt": {
    "catalogue_shown": [
      {
        "actuator": "concept_segment",
        "does": "Measure every instance of a named concept, as real pixel masks.",
        "requires": [
          "image",
          "phrase"
        ],
        "produces": [
          "region",
          "mark"
        ],
        "params_you_may_set": [
          "phrase"
        ]
      }
    ],
    "selected_actuator": "concept_segment",
    "selected_phrase": "folding architecture",
    "phrase_source": "control",
    "refused_actions": [],
    "dropped_params": [],
    "planner_notes": []
  },
  "invocations": [
    {
      "call_index": 1,
      "call_budget": 1,
      "actuator": "concept_segment",
      "adapter": "sam3",
      "kind": "organ",
      "started_at": 1786204905.073642,
      "ended_at": 1786204919.08162,
      "latency_ms": 14008.0,
      "warm": false,
      "load_ms": 2.2,
      "outcome": "empty",
      "error": null
    }
  ],
  "organ_observation": {
    "status": "empty",
    "concept": "folding architecture",
    "instance_count": 0,
    "truncated": false,
    "latency_ms": 14007.4,
    "device": "mps",
    "model": "facebook/sam3",
    "error": null,
    "detail": null,
    "instances": [],
    "repeats": [],
    "max_pairwise_iou": null
  },
  "actuator_observation": null,
  "invariance": {
    "image_sha256_before": "8882d66ff3f9f4c16e13406039ed1412d21fcbad43fc6bb917120ad1f8c0cfe4",
    "image_sha256_after": "8882d66ff3f9f4c16e13406039ed1412d21fcbad43fc6bb917120ad1f8c0cfe4",
    "image_unchanged": true,
    "actuators_called": [
      "concept_segment"
    ],
    "lock_held": true,
    "database_writes_attempted": [],
    "post_mutated": false,
    "post_sha256_before": null,
    "post_sha256_after": null
  },
  "artifacts": {
    "overlay": null,
    "contact_sheet": null,
    "review": "review.md",
    "observations": []
  }
}
